<?xml version="1.0"?>
<!DOCTYPE HPCToolkitExperiment [
<!-- ******************************************************************** -->
<!-- HPCToolkit Experiment DTD						  -->
<!-- Version 2.0							  -->
<!-- ******************************************************************** -->
<!ELEMENT HPCToolkitExperiment (Header, (SecCallPathProfile|SecFlatProfile)*)>
<!ATTLIST HPCToolkitExperiment
	  version CDATA #REQUIRED>

  <!-- ****************************************************************** -->

  <!-- Info/NV: flexible name-value pairs: (n)ame; (t)ype; (v)alue -->
  <!ELEMENT Info (NV*)>
  <!ATTLIST Info
	    n CDATA #IMPLIED>
  <!ELEMENT NV EMPTY>
  <!ATTLIST NV
	    n CDATA #REQUIRED
	    t CDATA #IMPLIED
	    v CDATA #REQUIRED>

  <!-- ****************************************************************** -->
  <!-- Header								  -->
  <!-- ****************************************************************** -->
  <!ELEMENT Header (Info*)>
  <!ATTLIST Header
	    n CDATA #REQUIRED>

  <!-- ****************************************************************** -->
  <!-- Section Header							  -->
  <!-- ****************************************************************** -->
  <!ELEMENT SecHeader (MetricTable?, MetricDBTable?, TraceDBTable?, LoadModuleTable?, FileTable?, ProcedureTable?, Info*)>

    <!-- MetricTable: -->
    <!ELEMENT MetricTable (Metric)*>

    <!-- Metric: (i)d; (n)ame -->
    <!--   (v)alue-type: transient type of values -->
    <!--   (t)ype: persistent type of metric -->
    <!--   fmt: format; show; -->
    <!ELEMENT Metric (MetricFormula*, Info?)>
    <!ATTLIST Metric
	      i            CDATA #REQUIRED
	      n            CDATA #REQUIRED
	      v            (raw|final|derived-incr|derived) "raw"
	      t            (inclusive|exclusive|nil) "nil"
	      partner      CDATA #IMPLIED
	      fmt          CDATA #IMPLIED
	      show         (1|0) "1"
	      show-percent (1|0) "1">

    <!-- MetricFormula represents derived metrics: (t)ype; (frm): formula -->
    <!ELEMENT MetricFormula (Info?)>
    <!ATTLIST MetricFormula
	      t   (combine|finalize) "finalize"
	      i   CDATA #IMPLIED
	      frm CDATA #REQUIRED>

    <!-- Metric data, used in sections: (n)ame [from Metric]; (v)alue -->
    <!ELEMENT M EMPTY>
    <!ATTLIST M
	      n CDATA #REQUIRED
	      v CDATA #REQUIRED>

    <!-- MetricDBTable: -->
    <!ELEMENT MetricDBTable (MetricDB)*>

    <!-- MetricDB: (i)d; (n)ame -->
    <!--   (t)ype: persistent type of metric -->
    <!--   db-glob:        file glob describing files in metric db -->
    <!--   db-id:          id within metric db -->
    <!--   db-num-metrics: number of metrics in db -->
    <!--   db-header-sz:   size (in bytes) of a db file header -->
    <!ELEMENT MetricDB EMPTY>
    <!ATTLIST MetricDB
	      i              CDATA #REQUIRED
	      n              CDATA #REQUIRED
	      t              (inclusive|exclusive|nil) "nil"
	      partner        CDATA #IMPLIED
	      db-glob        CDATA #IMPLIED
	      db-id          CDATA #IMPLIED
	      db-num-metrics CDATA #IMPLIED
	      db-header-sz   CDATA #IMPLIED>

    <!-- TraceDBTable: -->
    <!ELEMENT TraceDBTable (TraceDB)>

    <!-- TraceDB: (i)d -->
    <!--   db-min-time: min beginning time stamp (global) -->
    <!--   db-max-time: max ending time stamp (global) -->
    <!ELEMENT TraceDB EMPTY>
    <!ATTLIST TraceDB
	      i            CDATA #REQUIRED
	      db-glob      CDATA #IMPLIED
	      db-min-time  CDATA #IMPLIED
	      db-max-time  CDATA #IMPLIED
	      db-header-sz CDATA #IMPLIED>

    <!-- LoadModuleTable assigns a short name to a load module -->
    <!ELEMENT LoadModuleTable (LoadModule)*>

    <!ELEMENT LoadModule (Info?)>
    <!ATTLIST LoadModule
	      i CDATA #REQUIRED
	      n CDATA #REQUIRED>

    <!-- FileTable assigns a short name to a file -->
    <!ELEMENT FileTable (File)*>

    <!ELEMENT File (Info?)>
    <!ATTLIST File
	      i CDATA #REQUIRED
	      n CDATA #REQUIRED>

    <!-- ProcedureTable assigns a short name to a procedure -->
    <!ELEMENT ProcedureTable (Procedure)*>

    <!ELEMENT Procedure (Info?)>
    <!ATTLIST Procedure
	      i CDATA #REQUIRED
	      n CDATA #REQUIRED>

  <!-- ****************************************************************** -->
  <!-- Section: Call path profile					  -->
  <!-- ****************************************************************** -->
  <!ELEMENT SecCallPathProfile (SecHeader, SecCallPathProfileData)>
  <!ATTLIST SecCallPathProfile
	    i CDATA #REQUIRED
	    n CDATA #REQUIRED>

    <!ELEMENT SecCallPathProfileData (PF|M)*>
      <!-- Procedure frame -->
      <!--   (i)d: unique identifier for cross referencing -->
      <!--   (s)tatic scope id -->
      <!--   (n)ame: a string or an id in ProcedureTable -->
      <!--   (lm) load module: a string or an id in LoadModuleTable -->
      <!--   (f)ile name: a string or an id in LoadModuleTable -->
      <!--   (l)ine range: "beg-end" (inclusive range) -->
      <!--   (a)lien: whether frame is alien to enclosing P -->
      <!--   (str)uct: hpcstruct node id -->
      <!--   (v)ma-range-set: "{[beg-end), [beg-end)...}" -->
      <!ELEMENT PF (PF|Pr|L|C|S|M)*>
      <!ATTLIST PF
		i  CDATA #IMPLIED
		s  CDATA #IMPLIED
		n  CDATA #REQUIRED
		lm CDATA #IMPLIED
		f  CDATA #IMPLIED
		l  CDATA #IMPLIED
		str  CDATA #IMPLIED
		v  CDATA #IMPLIED>
      <!-- Procedure (static): GOAL: replace with 'P' -->
      <!ELEMENT Pr (Pr|L|C|S|M)*>
      <!ATTLIST Pr
                i  CDATA #IMPLIED
		s  CDATA #IMPLIED
                n  CDATA #REQUIRED
		lm CDATA #IMPLIED
		f  CDATA #IMPLIED
                l  CDATA #IMPLIED
		a  (1|0) "0"
		str  CDATA #IMPLIED
		v  CDATA #IMPLIED>
      <!-- Callsite (a special StatementRange) -->
      <!ELEMENT C (PF|M)*>
      <!ATTLIST C
		i CDATA #IMPLIED
		s CDATA #IMPLIED
		l CDATA #IMPLIED
		str CDATA #IMPLIED
		v CDATA #IMPLIED>

  <!-- ****************************************************************** -->
  <!-- Section: Flat profile						  -->
  <!-- ****************************************************************** -->
  <!ELEMENT SecFlatProfile (SecHeader, SecFlatProfileData)>
  <!ATTLIST SecFlatProfile
	    i CDATA #REQUIRED
	    n CDATA #REQUIRED>

    <!ELEMENT SecFlatProfileData (LM|M)*>
      <!-- Load module: (i)d; (n)ame; (v)ma-range-set -->
      <!ELEMENT LM (F|P|M)*>
      <!ATTLIST LM
                i CDATA #IMPLIED
                n CDATA #REQUIRED
		v CDATA #IMPLIED>
      <!-- File -->
      <!ELEMENT F (P|L|S|M)*>
      <!ATTLIST F
                i CDATA #IMPLIED
                n CDATA #REQUIRED>
      <!-- Procedure (Note 1) -->
      <!ELEMENT P (P|A|L|S|C|M)*>
      <!ATTLIST P
                i CDATA #IMPLIED
                n CDATA #REQUIRED
                l CDATA #IMPLIED
		str CDATA #IMPLIED
		v CDATA #IMPLIED>
      <!-- Alien (Note 1) -->
      <!ELEMENT A (A|L|S|C|M)*>
      <!ATTLIST A
                i CDATA #IMPLIED
                f CDATA #IMPLIED
                n CDATA #IMPLIED
                l CDATA #IMPLIED
		str CDATA #IMPLIED
		v CDATA #IMPLIED>
      <!-- Loop (Note 1,2) -->
      <!ELEMENT L (A|Pr|L|S|C|M)*>
      <!ATTLIST L
		i CDATA #IMPLIED
		s CDATA #IMPLIED
		l CDATA #IMPLIED
	        f CDATA #IMPLIED
		str CDATA #IMPLIED
		v CDATA #IMPLIED>
      <!-- Statement (Note 2) -->
      <!--   (it): trace record identifier -->
      <!ELEMENT S (S|M)*>
      <!ATTLIST S
		i  CDATA #IMPLIED
		it CDATA #IMPLIED
		s  CDATA #IMPLIED
		l  CDATA #IMPLIED
		str  CDATA #IMPLIED
		v  CDATA #IMPLIED>
      <!-- Note 1: Contained Cs may not contain PFs -->
      <!-- Note 2: The 's' attribute is not used for flat profiles -->
]>
<HPCToolkitExperiment version="2.0">
<Header n="wave-oti.out">
  <Info/>
</Header>
<SecCallPathProfile i="0" n="wave-oti.out">
<SecHeader>
  <MetricTable>
    <Metric i="0" n="CPUTIME (usec).[0,0]" v="raw" t="nil" show="1" show-percent="1">
      <Info><NV n="units" v="events"/><NV n="period" v="1"/></Info>
    </Metric>
  </MetricTable>
  <MetricDBTable>
  </MetricDBTable>
  <LoadModuleTable>
    <LoadModule i="2" n="/home/pedroeusebio/my-work/computacao-de-alto-desempenho/tp1/exercicio4/wave/wave-oti.out"/>
    <LoadModule i="159" n="/home/pedroeusebio/local/hpctoolkit/lib/hpctoolkit/ext-libs/libmonitor.so.0.0.0"/>
    <LoadModule i="163" n="/lib/x86_64-linux-gnu/libc-2.19.so"/>
    <LoadModule i="167" n="/lib/x86_64-linux-gnu/libpthread-2.19.so"/>
  </LoadModuleTable>
  <FileTable>
    <File i="3" n="&lt;unknown file&gt;"/>
    <File i="5" n=""/>
    <File i="6" n=""/>
    <File i="9" n=""/>
    <File i="10" n=""/>
    <File i="44" n=""/>
    <File i="47" n=""/>
    <File i="50" n=""/>
    <File i="123" n=""/>
    <File i="124" n=""/>
    <File i="125" n=""/>
    <File i="126" n=""/>
    <File i="129" n=""/>
    <File i="138" n=""/>
    <File i="143" n=""/>
    <File i="144" n=""/>
    <File i="160" n="&lt;unknown file&gt;"/>
    <File i="164" n="&lt;unknown file&gt;"/>
    <File i="168" n="&lt;unknown file&gt;"/>
  </FileTable>
  <ProcedureTable>
    <Procedure i="4" n="Allocate3DMatrix(int, int, int)"/>
    <Procedure i="8" n="Deallocate3DMatrix(float***, Parameters*)"/>
    <Procedure i="43" n="initialize(float***, float***, float***, Parameters*)"/>
    <Procedure i="122" n="iso_3dfd_it(float***, float***, float***, float*, int, int, int)"/>
    <Procedure i="128" n="main"/>
    <Procedure i="137" n="run_wave_propagation(float***, float***, float***, float*, Parameters*)"/>
    <Procedure i="142" n="write_plane_XY(float***, Parameters*, int, char const*)"/>
    <Procedure i="161" n="&lt;program root&gt;" f="1"/>
    <Procedure i="165" n="&lt;unknown procedure&gt;"/>
    <Procedure i="169" n="_pthread_cleanup_pop_restore"/>
    <Procedure i="171" n="_pthread_cleanup_push_defer"/>
  </ProcedureTable>
  <Info/>
</SecHeader>
<SecCallPathProfileData>
<PF i="2" s="161" l="0" lm="159" f="160" n="161">
<C i="3" s="162" l="0">
<PF i="4" s="128" l="0" lm="2" f="3" n="128">
<L i="5" s="129" l="0" f="129">
<C i="6" s="130" l="0">
<PF i="7" s="4" l="0" lm="2" f="3" n="4">
<L i="8" s="5" l="0" f="5">
<L i="9" s="6" l="0" f="6">
<C i="10" s="7" l="0">
<PF i="11" s="165" l="0" lm="163" f="164" n="165">
<C i="12" s="166" l="0">
<PF i="13" s="165" l="0" lm="163" f="164" n="165">
<S i="14" s="166" l="0">
<M n="0" v="13952"/>
</S>
</PF>
</C>
</PF>
</C>
</L>
</L>
</PF>
</C>
<C i="15" s="130" l="0">
<PF i="16" s="4" l="0" lm="2" f="3" n="4">
<L i="17" s="5" l="0" f="5">
<L i="18" s="6" l="0" f="6">
<C i="19" s="7" l="0">
<PF i="20" s="165" l="0" lm="163" f="164" n="165">
<C i="21" s="166" l="0">
<PF i="22" s="165" l="0" lm="163" f="164" n="165">
<S i="23" s="166" l="0">
<M n="0" v="15954"/>
</S>
</PF>
</C>
</PF>
</C>
</L>
</L>
</PF>
</C>
<C i="24" s="130" l="0">
<PF i="25" s="4" l="0" lm="2" f="3" n="4">
<L i="26" s="5" l="0" f="5">
<L i="27" s="6" l="0" f="6">
<C i="28" s="7" l="0">
<PF i="29" s="165" l="0" lm="163" f="164" n="165">
<C i="30" s="166" l="0">
<PF i="31" s="165" l="0" lm="163" f="164" n="165">
<S i="32" s="166" l="0">
<M n="0" v="15952"/>
</S>
</PF>
</C>
</PF>
</C>
</L>
</L>
</PF>
</C>
<C i="33" s="130" l="0">
<PF i="34" s="43" l="0" lm="2" f="3" n="43">
<L i="35" s="44" l="0" f="44">
<L i="36" s="47" l="0" f="47">
<L i="37" s="50" l="0" f="50">
<S i="38" s="62" l="0">
<M n="0" v="1.71709e+06"/>
</S>
</L>
</L>
</L>
</PF>
</C>
<C i="39" s="130" l="0">
<PF i="40" s="142" l="0" lm="2" f="3" n="142">
<L i="41" s="143" l="0" f="143">
<L i="42" s="144" l="0" f="144">
<C i="43" s="145" l="0">
<PF i="44" s="165" l="0" lm="163" f="164" n="165">
<C i="45" s="166" l="0">
<PF i="46" s="165" l="0" lm="163" f="164" n="165">
<C i="47" s="166" l="0">
<PF i="48" s="165" l="0" lm="163" f="164" n="165">
<C i="49" s="166" l="0">
<PF i="50" s="165" l="0" lm="163" f="164" n="165">
<C i="51" s="166" l="0">
<PF i="52" s="165" l="0" lm="163" f="164" n="165">
<S i="53" s="166" l="0">
<M n="0" v="7980"/>
</S>
</PF>
</C>
<S i="54" s="166" l="0">
<M n="0" v="5183"/>
</S>
</PF>
</C>
<C i="55" s="166" l="0">
<PF i="56" s="165" l="0" lm="163" f="164" n="165">
<C i="57" s="166" l="0">
<PF i="58" s="165" l="0" lm="163" f="164" n="165">
<S i="59" s="166" l="0">
<M n="0" v="7978"/>
</S>
</PF>
</C>
<S i="60" s="166" l="0">
<M n="0" v="7999"/>
</S>
</PF>
</C>
<C i="61" s="166" l="0">
<PF i="62" s="165" l="0" lm="163" f="164" n="165">
<C i="63" s="166" l="0">
<PF i="64" s="165" l="0" lm="163" f="164" n="165">
<S i="65" s="166" l="0">
<M n="0" v="7994"/>
</S>
</PF>
</C>
<S i="66" s="166" l="0">
<M n="0" v="7733"/>
</S>
</PF>
</C>
<S i="67" s="166" l="0">
<M n="0" v="39838"/>
</S>
</PF>
</C>
</PF>
</C>
</PF>
</C>
<S i="68" s="145" l="0">
<M n="0" v="7988"/>
</S>
</L>
</L>
</PF>
</C>
<C i="69" s="130" l="0">
<PF i="70" s="137" l="0" lm="2" f="3" n="137">
<L i="71" s="138" l="0" f="138">
<C i="72" s="139" l="0">
<PF i="73" s="122" l="0" lm="2" f="3" n="122">
<L i="74" s="123" l="0" f="123">
<L i="75" s="124" l="0" f="124">
<L i="76" s="125" l="0" f="125">
<L i="77" s="126" l="0" f="126">
<S i="78" s="127" l="0">
<M n="0" v="6.87886e+08"/>
</S>
</L>
</L>
</L>
</L>
</PF>
</C>
<C i="79" s="139" l="0">
<PF i="80" s="122" l="0" lm="2" f="3" n="122">
<L i="81" s="123" l="0" f="123">
<L i="82" s="124" l="0" f="124">
<L i="83" s="125" l="0" f="125">
<L i="84" s="126" l="0" f="126">
<S i="85" s="127" l="0">
<M n="0" v="6.79463e+08"/>
</S>
</L>
</L>
</L>
</L>
</PF>
</C>
<C i="86" s="139" l="0">
<PF i="87" s="142" l="0" lm="2" f="3" n="142">
<L i="88" s="143" l="0" f="143">
<L i="89" s="144" l="0" f="144">
<C i="90" s="145" l="0">
<PF i="91" s="165" l="0" lm="163" f="164" n="165">
<C i="92" s="166" l="0">
<PF i="93" s="165" l="0" lm="163" f="164" n="165">
<C i="94" s="166" l="0">
<PF i="95" s="169" l="0" lm="167" f="168" n="169">
<S i="96" s="170" l="0">
<M n="0" v="8000"/>
</S>
</PF>
</C>
<C i="97" s="166" l="0">
<PF i="98" s="171" l="0" lm="167" f="168" n="171">
<S i="99" s="172" l="0">
<M n="0" v="15969"/>
</S>
</PF>
</C>
<C i="100" s="166" l="0">
<PF i="101" s="165" l="0" lm="163" f="164" n="165">
<S i="102" s="166" l="0">
<M n="0" v="7983"/>
</S>
</PF>
</C>
<C i="103" s="166" l="0">
<PF i="104" s="165" l="0" lm="163" f="164" n="165">
<C i="105" s="166" l="0">
<PF i="106" s="165" l="0" lm="163" f="164" n="165">
<C i="107" s="166" l="0">
<PF i="108" s="165" l="0" lm="163" f="164" n="165">
<S i="109" s="166" l="0">
<M n="0" v="15962"/>
</S>
</PF>
</C>
</PF>
</C>
<C i="110" s="166" l="0">
<PF i="111" s="165" l="0" lm="163" f="164" n="165">
<S i="112" s="166" l="0">
<M n="0" v="7992"/>
</S>
</PF>
</C>
<C i="113" s="166" l="0">
<PF i="114" s="165" l="0" lm="163" f="164" n="165">
<S i="115" s="166" l="0">
<M n="0" v="15978"/>
</S>
</PF>
</C>
<C i="116" s="166" l="0">
<PF i="117" s="165" l="0" lm="163" f="164" n="165">
<S i="118" s="166" l="0">
<M n="0" v="15982"/>
</S>
</PF>
</C>
<C i="119" s="166" l="0">
<PF i="120" s="165" l="0" lm="163" f="164" n="165">
<C i="121" s="166" l="0">
<PF i="122" s="165" l="0" lm="163" f="164" n="165">
<S i="123" s="166" l="0">
<M n="0" v="7991"/>
</S>
</PF>
</C>
<C i="124" s="166" l="0">
<PF i="125" s="165" l="0" lm="163" f="164" n="165">
<S i="126" s="166" l="0">
<M n="0" v="199683"/>
</S>
</PF>
</C>
<S i="127" s="166" l="0">
<M n="0" v="72234"/>
</S>
</PF>
</C>
<C i="128" s="166" l="0">
<PF i="129" s="165" l="0" lm="163" f="164" n="165">
<C i="130" s="166" l="0">
<PF i="131" s="165" l="0" lm="163" f="164" n="165">
<S i="132" s="166" l="0">
<M n="0" v="71811"/>
</S>
</PF>
</C>
<C i="133" s="166" l="0">
<PF i="134" s="165" l="0" lm="163" f="164" n="165">
<S i="135" s="166" l="0">
<M n="0" v="7998"/>
</S>
</PF>
</C>
<S i="136" s="166" l="0">
<M n="0" v="199614"/>
</S>
</PF>
</C>
<C i="137" s="166" l="0">
<PF i="138" s="165" l="0" lm="163" f="164" n="165">
<C i="139" s="166" l="0">
<PF i="140" s="165" l="0" lm="163" f="164" n="165">
<S i="141" s="166" l="0">
<M n="0" v="7992"/>
</S>
</PF>
</C>
<S i="142" s="166" l="0">
<M n="0" v="23980"/>
</S>
</PF>
</C>
<C i="143" s="166" l="0">
<PF i="144" s="165" l="0" lm="163" f="164" n="165">
<S i="145" s="166" l="0">
<M n="0" v="7971"/>
</S>
</PF>
</C>
<C i="146" s="166" l="0">
<PF i="147" s="165" l="0" lm="163" f="164" n="165">
<S i="148" s="166" l="0">
<M n="0" v="15981"/>
</S>
</PF>
</C>
<C i="149" s="166" l="0">
<PF i="150" s="165" l="0" lm="163" f="164" n="165">
<S i="151" s="166" l="0">
<M n="0" v="7987"/>
</S>
</PF>
</C>
<C i="152" s="166" l="0">
<PF i="153" s="165" l="0" lm="163" f="164" n="165">
<S i="154" s="166" l="0">
<M n="0" v="23975"/>
</S>
</PF>
</C>
<C i="155" s="166" l="0">
<PF i="156" s="165" l="0" lm="163" f="164" n="165">
<S i="157" s="166" l="0">
<M n="0" v="7990"/>
</S>
</PF>
</C>
<C i="158" s="166" l="0">
<PF i="159" s="165" l="0" lm="163" f="164" n="165">
<C i="160" s="166" l="0">
<PF i="161" s="165" l="0" lm="163" f="164" n="165">
<C i="162" s="166" l="0">
<PF i="163" s="165" l="0" lm="163" f="164" n="165">
<C i="164" s="166" l="0">
<PF i="165" s="165" l="0" lm="163" f="164" n="165">
<S i="166" s="166" l="0">
<M n="0" v="31387"/>
</S>
</PF>
</C>
</PF>
</C>
</PF>
</C>
</PF>
</C>
<S i="167" s="166" l="0">
<M n="0" v="383158"/>
</S>
</PF>
</C>
<C i="168" s="166" l="0">
<PF i="169" s="165" l="0" lm="163" f="164" n="165">
<S i="170" s="166" l="0">
<M n="0" v="7994"/>
</S>
</PF>
</C>
<S i="171" s="166" l="0">
<M n="0" v="135824"/>
</S>
</PF>
</C>
<S i="172" s="166" l="0">
<M n="0" v="15826"/>
</S>
</PF>
</C>
<S i="173" s="145" l="0">
<M n="0" v="79908"/>
</S>
</L>
</L>
</PF>
<PF i="174" s="165" l="0" lm="163" f="164" n="165">
<S i="175" s="166" l="0">
<M n="0" v="7996"/>
</S>
</PF>
</C>
</L>
</PF>
</C>
<C i="176" s="130" l="0">
<PF i="177" s="8" l="0" lm="2" f="3" n="8">
<L i="178" s="9" l="0" f="9">
<L i="179" s="10" l="0" f="10">
<C i="180" s="11" l="0">
<PF i="181" s="165" l="0" lm="163" f="164" n="165">
<C i="182" s="166" l="0">
<PF i="183" s="165" l="0" lm="163" f="164" n="165">
<C i="184" s="166" l="0">
<PF i="185" s="165" l="0" lm="163" f="164" n="165">
<S i="186" s="166" l="0">
<M n="0" v="7961"/>
</S>
</PF>
</C>
</PF>
</C>
</PF>
</C>
</L>
</L>
</PF>
</C>
<C i="187" s="130" l="0">
<PF i="188" s="8" l="0" lm="2" f="3" n="8">
<L i="189" s="9" l="0" f="9">
<L i="190" s="10" l="0" f="10">
<C i="191" s="11" l="0">
<PF i="192" s="165" l="0" lm="163" f="164" n="165">
<C i="193" s="166" l="0">
<PF i="194" s="165" l="0" lm="163" f="164" n="165">
<C i="195" s="166" l="0">
<PF i="196" s="165" l="0" lm="163" f="164" n="165">
<C i="197" s="166" l="0">
<PF i="198" s="165" l="0" lm="163" f="164" n="165">
<C i="199" s="166" l="0">
<PF i="200" s="165" l="0" lm="163" f="164" n="165">
<S i="201" s="166" l="0">
<M n="0" v="7777"/>
</S>
</PF>
</C>
</PF>
</C>
</PF>
</C>
</PF>
</C>
</PF>
</C>
</L>
</L>
</PF>
</C>
</L>
</PF>
</C>
</PF>
</SecCallPathProfileData>
</SecCallPathProfile>
</HPCToolkitExperiment>
